{
 "contract": "1.2",
 "generated_at": "2026-10-12T14:02:50Z",
 "source": "manual",
 "source_files": {
  "tracker": {
   "name": "migrator-assignment-tracker.xlsx",
   "sha256": "d4befa770de488ecc6891553090816cbeaaf6325f2d161edc62ccd628503f815",
   "mtime": "2026-10-12T14:00:18Z",
   "web_url": "https://stamats-my.sharepoint.com/personal/eric_yerke_stamats_com/Documents/Migration%20Matrix/migrator-assignment-tracker.xlsx?web=1"
  },
  "matrices": [
   {
    "name": "content-matrix-morehead.xlsx",
    "sha256": "bd0c44a0b69403213a462413be4375e1646008a3735fd55691f078a8feb4c584",
    "mtime": "2026-10-12T14:00:19Z",
    "web_url": "https://stamats-my.sharepoint.com/personal/eric_yerke_stamats_com/Documents/Migration%20Matrix/content-matrix-morehead.xlsx?web=1"
   }
  ],
  "folder_url": "https://stamats-my.sharepoint.com/personal/eric_yerke_stamats_com/Documents/Migration%20Matrix"
 },
 "week": "2026-10-12",
 "week_lbl": "10/12",
 "data": {
  "changes": [],
  "generated": "2026-10-12",
  "week": "2026-10-12",
  "week_lbl": "10/12",
  "wk_hrs": 140.0,
  "logo": "assets/stamats-logo.svg",
  "clients": [
   {
    "name": "Washtenaw Community College",
    "type": "AS IS 761, OPTIMIZE 41",
    "total": 802.0,
    "done": 0,
    "remaining": 578,
    "pct": 0,
    "deadline": "2026-01-01",
    "projected": "2026-11-08",
    "hours_left": 331,
    "verdict": "284 days overdue",
    "tone": "crit",
    "status": "active",
    "crew": [
     {
      "name": "Brian",
      "hours": 29.0
     }
    ],
    "moves": [
     "412 pages of QA backlog: Katie (30h free) could take it this week."
    ],
    "archived": false,
    "series": [
     [
      "9/28",
      332.0,
      0
     ],
     [
      "10/12",
      58.0,
      0
     ]
    ],
    "actual_pace": 0,
    "required_pace": null,
    "days_left": -284,
    "plan_rate": 1.9501519756838905,
    "actual_rate": null,
    "qa_remaining": 412,
    "detail": {
     "weeks": [
      "9/28",
      "10/12"
     ],
     "rows": [
      {
       "name": "Brian",
       "cells": [
        [
         58,
         29.0,
         0
        ],
        [
         58,
         29.0,
         0
        ]
       ]
      },
      {
       "name": "Debbie",
       "cells": [
        [
         56,
         28.0,
         0
        ],
        null
       ]
      },
      {
       "name": "Chris J",
       "cells": [
        [
         52,
         26.0,
         0
        ],
        null
       ]
      },
      {
       "name": "Katie",
       "cells": [
        [
         166,
         13.8,
         0
        ],
        null
       ]
      }
     ]
    },
    "done_source": "tracker",
    "matrix": null,
    "list": "active",
    "assigned": 224,
    "left": 802,
    "qa_done": 0,
    "min_per_page": 30.8,
    "qa_min_per_page": 5.0,
    "hours_to_finish": 478,
    "rate_set": true,
    "priority": null,
    "start_date": "2026-09-21",
    "mig_deadline": "2026-10-23",
    "page_types": {
     "as is": {
      "pages": 761.0,
      "min_per_page": 30.0,
      "rate": 2.0,
      "hours": 380.5
     },
     "optimize": {
      "pages": 41.0,
      "min_per_page": 45.0,
      "rate": 1.3333333333333333,
      "hours": 30.75
     },
     "qa": {
      "pages": 802.0,
      "min_per_page": 5.0,
      "rate": 12.0,
      "hours": 66.83
     }
    },
    "qa_pages": 802.0
   },
   {
    "name": "HM Publishing \"On Health\"",
    "type": "PUBLISH 786",
    "total": 786.0,
    "done": 0,
    "remaining": 138,
    "pct": 0,
    "deadline": null,
    "projected": "2026-11-08",
    "hours_left": 12,
    "verdict": "on track",
    "tone": "ok",
    "status": "active",
    "crew": [],
    "moves": [
     "Only about 11.5 hrs of work: Chris J (30h free) could clear it alone.",
     "138 pages of QA backlog: Katie (30h free) could take it this week."
    ],
    "archived": false,
    "series": [
     [
      "9/28",
      432.0,
      0
     ],
     [
      "10/5",
      216.0,
      0
     ]
    ],
    "actual_pace": 0,
    "required_pace": null,
    "days_left": null,
    "plan_rate": 12.0,
    "actual_rate": null,
    "qa_remaining": 138,
    "detail": {
     "weeks": [
      "9/28",
      "10/5"
     ],
     "rows": [
      {
       "name": "Amanda",
       "cells": [
        [
         432,
         36.0,
         0
        ],
        [
         216,
         18.0,
         0
        ]
       ]
      }
     ]
    },
    "done_source": "tracker",
    "matrix": null,
    "list": "active",
    "assigned": 648,
    "left": 786,
    "qa_done": 0,
    "min_per_page": 5.0,
    "qa_min_per_page": null,
    "hours_to_finish": 66,
    "rate_set": true,
    "priority": null,
    "start_date": null,
    "mig_deadline": null,
    "page_types": {
     "publish": {
      "pages": 786.0,
      "min_per_page": 5.0,
      "rate": 12.0,
      "hours": 65.5
     }
    },
    "qa_pages": null
   },
   {
    "name": "NMC Migration Test",
    "type": "AS IS 20",
    "total": 20.0,
    "done": 0,
    "remaining": 20,
    "pct": 0,
    "deadline": null,
    "projected": null,
    "hours_left": 0,
    "verdict": "no rates set",
    "tone": "warn",
    "status": "planned",
    "crew": [],
    "moves": [
     "Nobody is on this project this week: it moves zero pages until someone is assigned."
    ],
    "archived": false,
    "series": [
     [
      "10/12",
      0,
      0
     ]
    ],
    "actual_pace": 0,
    "required_pace": null,
    "days_left": null,
    "plan_rate": null,
    "actual_rate": null,
    "qa_remaining": 20,
    "detail": {
     "weeks": [
      "10/12"
     ],
     "rows": []
    },
    "done_source": "tracker",
    "matrix": null,
    "list": "planned",
    "assigned": 0,
    "left": 20,
    "qa_done": 0,
    "min_per_page": null,
    "qa_min_per_page": null,
    "hours_to_finish": null,
    "rate_set": false,
    "priority": null,
    "start_date": "2026-12-01",
    "mig_deadline": null,
    "page_types": {
     "as is": {
      "pages": 20.0,
      "min_per_page": null,
      "rate": null,
      "hours": null
     }
    },
    "qa_pages": null
   },
   {
    "name": "Coe",
    "type": null,
    "total": 0,
    "done": 0,
    "remaining": 0,
    "pct": 0,
    "deadline": "2026-11-30",
    "projected": null,
    "hours_left": 0,
    "verdict": "no page count yet",
    "tone": "warn",
    "status": "planned",
    "crew": [],
    "moves": [],
    "archived": false,
    "series": [
     [
      "10/12",
      0,
      0
     ]
    ],
    "actual_pace": 0,
    "required_pace": null,
    "days_left": 49,
    "plan_rate": null,
    "actual_rate": null,
    "qa_remaining": 0,
    "detail": {
     "weeks": [
      "10/12"
     ],
     "rows": []
    },
    "done_source": "tracker",
    "matrix": null,
    "list": "planned",
    "assigned": 0,
    "left": 0,
    "qa_done": 0,
    "min_per_page": null,
    "qa_min_per_page": null,
    "hours_to_finish": null,
    "rate_set": false,
    "priority": null,
    "start_date": "2026-10-26",
    "mig_deadline": null,
    "page_types": null,
    "qa_pages": null
   },
   {
    "name": "HM Physicians",
    "type": null,
    "total": 0,
    "done": 0,
    "remaining": 0,
    "pct": 0,
    "deadline": null,
    "projected": null,
    "hours_left": 0,
    "verdict": "no page count yet",
    "tone": "warn",
    "status": "planned",
    "crew": [],
    "moves": [],
    "archived": false,
    "series": [
     [
      "10/12",
      0,
      0
     ]
    ],
    "actual_pace": 0,
    "required_pace": null,
    "days_left": null,
    "plan_rate": null,
    "actual_rate": null,
    "qa_remaining": 0,
    "detail": {
     "weeks": [
      "10/12"
     ],
     "rows": []
    },
    "done_source": "tracker",
    "matrix": null,
    "list": "planned",
    "assigned": 0,
    "left": 0,
    "qa_done": 0,
    "min_per_page": null,
    "qa_min_per_page": null,
    "hours_to_finish": null,
    "rate_set": false,
    "priority": null,
    "start_date": "2026-11-01",
    "mig_deadline": null,
    "page_types": null,
    "qa_pages": null
   }
  ],
  "team": [
   {
    "name": "Brian",
    "role": "Senior migrator",
    "hours": 58.0,
    "assigned": 116,
    "done": 0,
    "left": 116,
    "comp": 0,
    "vel": 0.0,
    "avail": 32.0,
    "wk_hours": 29.0,
    "this_week": {
     "assigned": 58,
     "done": 0,
     "hours": 29.0
    },
    "last_week": {
     "assigned": 0,
     "done": 0,
     "hours": 0
    },
    "weekly": [
     [
      "9/28",
      29.0,
      0
     ],
     [
      "10/12",
      29.0,
      0
     ]
    ],
    "projects": [
     [
      "Washtenaw Community College",
      58.0,
      116,
      0
     ]
    ]
   },
   {
    "name": "Debbie",
    "role": "Senior migrator",
    "hours": 28.0,
    "assigned": 56,
    "done": 0,
    "left": 56,
    "comp": 0,
    "vel": 0.0,
    "avail": 29.0,
    "wk_hours": 0,
    "this_week": {
     "assigned": 0,
     "done": 0,
     "hours": 0
    },
    "last_week": {
     "assigned": 0,
     "done": 0,
     "hours": 0
    },
    "weekly": [
     [
      "9/28",
      28.0,
      0
     ]
    ],
    "projects": [
     [
      "Washtenaw Community College",
      28.0,
      56,
      0
     ]
    ]
   },
   {
    "name": "Chris J",
    "role": "Senior migrator/Proofer",
    "hours": 26.0,
    "assigned": 52,
    "done": 0,
    "left": 52,
    "comp": 0,
    "vel": 0.0,
    "avail": 30.0,
    "wk_hours": 0,
    "this_week": {
     "assigned": 0,
     "done": 0,
     "hours": 0
    },
    "last_week": {
     "assigned": 0,
     "done": 0,
     "hours": 0
    },
    "weekly": [
     [
      "9/28",
      26.0,
      0
     ]
    ],
    "projects": [
     [
      "Washtenaw Community College",
      26.0,
      52,
      0
     ]
    ]
   },
   {
    "name": "Katie",
    "role": "Q/A/Senior migrator",
    "hours": 13.8,
    "assigned": 166,
    "done": 0,
    "left": 166,
    "comp": 0,
    "vel": 0.0,
    "avail": 30.0,
    "wk_hours": 0,
    "this_week": {
     "assigned": 0,
     "done": 0,
     "hours": 0
    },